Database : Database is a collection of records in tabular format. 

    there are mainly 2 types of records 

    1) DBMS : database management system 

    2) RDBMS : Relational database management system

--------------------------------------------------------
what is table ?

    Table is a one kind place in database which is contain records 
    
    in simple language we can say that table is a combination 
    of row and column. 

    row : row which is represent specific single record 

    column : which is represent field of table 

    |     |
    V     V 
    -------------------------------
    id  |   Name |  Email      
    -------------------------------
    1   |   AAA  |  a@gmail.com    (r1)
    2   |   BBB  |  b@gmail.com    (r2)
    
    column :  id , name , email 

--------------------------------------------------------
sql : sql stands for structure query language. 

    using sql we can add , remove , update , filter records from the table. 

-----------------------------------------
types of sql : 

1) DDL : Data defination language. 

    using ddl command we can add database , remove , modify and 
    many more with tables. 

    using of ddl command we can modify structure of table. and can create or remove 
    database.
    
    syntax : 

        #create database <databasename>; 

        e.g.  #create database 18_junedb 

---------------------------------------------
    open cmd 
        |
        V 
    login your mysql account 
        |
        V 
    
    #mysql -u root -p 
    Enter password : 

------------------------------------
check all databases 

    #show databases;

----------------------------------
==> create database 18junedb;
Query OK, 1 row affected (0.03 sec)

mysql> show databases;
+--------------------+
| Database           |
+--------------------+
| 18junedb           |
| information_schema |
| mysql              |
| performance_schema |
| sys                |
+--------------------+
5 rows in set (0.00 sec)

========================================
                    ZOMATO 
                    |
                    V 
    customer       rest         rider        feedback

---------------------------------------
# use <database>;

mysql> use 18junedb;
Database changed
---------------------------------------
table creation 

syntax : 
    create table <tablename>
    (
        fieldname   datatype,
        fieldname   datatype,
        fieldname   datatype
        .
        .
    );

mysql> create table student
    -> (
    -> id int,
    -> name varchar(20)
    -> );
Query OK, 0 rows affected (0.06 sec)

mysql> desc student;
+-------+-------------+------+-----+---------+-------+
| Field | Type        | Null | Key | Default | Extra |
+-------+-------------+------+-----+---------+-------+
| id    | int         | YES  |     | NULL    |       |
| name  | varchar(20) | YES  |     | NULL    |       |
+-------+-------------+------+-----+---------+-------+

DDL : commands : 

    1) CREATE 
    2) ALTER 
    3) TRUNCATE 
    4) DROP 

---------------------------------
4) DROP : to remove table from the database 

        and to remove database 

        syntax : 
        #drop table <tablename>;
        #drop database <databasename>;
--------------------------------------------
mysql> drop table student;
Query OK, 0 rows affected (0.03 sec)

mysql> desc student;
ERROR 1146 (42S02): Table '18junedb.student' doesn't exist


mysql> drop database 18junedb;
Query OK, 0 rows affected (0.02 sec)

mysql> show databases;
+--------------------+
| Database           |
+--------------------+
| information_schema |
| mysql              |
| performance_schema |
| sys                |
+--------------------+

======================================================
    2) ALTER :  Alter command mainly use to restructure of table 

        using of Alter command we can modify column name, datatype , we can add new column 
        we can drop existing column using of Alter command.


    C:\Users\baps>mysql -u root -p

            mysql> show databases;

            mysql> create database 18june;

            mysql> use 18june;

            mysql> create table student
                -> (
                -> id int,
                -> name varchar(20)
                -> );

            requirement of new column 

            syntax : alter table <tablename> add <columnname> <datatype>; 

            mysql> alter table student add email varchar(20);
            
            mysql> desc student;
                +-------+-------------+------+-----+---------+-------+
                | Field | Type        | Null | Key | Default | Extra |
                +-------+-------------+------+-----+---------+-------+
                | id    | int         | YES  |     | NULL    |       |
                | name  | varchar(20) | YES  |     | NULL    |       |
                | email | varchar(20) | YES  |     | NULL    |       |
                +-------+-------------+------+----

            for remove any unwanted field or column from existing table 

            syntax : alter table <tablename> drop <columnname>;

            mysql> alter table student drop email;

            mysql> desc student;
                +-------+-------------+------+-----+---------+-------+
                | Field | Type        | Null | Key | Default | Extra |
                +-------+-------------+------+-----+---------+-------+
                | id    | int         | YES  |     | NULL    |       |
                | name  | varchar(20) | YES  |     | NULL    |       |

            mysql> alter table student add email varchar(20) first;

            mysql> desc student;
            +-------+-------------+------+-----+---------+-------+
            | Field | Type        | Null | Key | Default | Extra |
            +-------+-------------+------+-----+---------+-------+
            | email | varchar(20) | YES  |     | NULL    |       |
            | id    | int         | YES  |     | NULL    |       |
            | name  | varchar(20) | YES  |     | NULL    |       |
            +-------+-------------+------+-----+---------+-------+

            mysql> alter table student add email varchar(20) after id;
            mysql> desc student;
            +-------+-------------+------+-----+---------+-------+
            | Field | Type        | Null | Key | Default | Extra |
            +-------+-------------+------+-----+---------+-------+
            | id    | int         | YES  |     | NULL    |       |
            | email | varchar(20) | YES  |     | NULL    |       |
            | name  | varchar(20) | YES  |     | NULL    |       |
            +-------+-------------+------+-----+---------+-------+
            
            mysql> alter table student modify email varchar(40);

            mysql> desc student;
                +-------+-------------+------+-----+---------+-------+
                | Field | Type        | Null | Key | Default | Extra |
                +-------+-------------+------+-----+---------+-------+
                | id    | int         | YES  |     | NULL    |       |
                | email | varchar(40) | YES  |     | NULL    |       |
                | name  | varchar(20) | YES  |     | NULL    |       |
                +-------+-------------+------+-----+---------+-------+
                3 rows in set (0.00 sec) 

            mysql>  alter table student change name first_name varchar(20);
            Query OK, 0 rows affected (0.03 sec)
            Records: 0  Duplicates: 0  Warnings: 0

            mysql> desc student;
            +------------+-------------+------+-----+---------+-------+
            | Field      | Type        | Null | Key | Default | Extra |
            +------------+-------------+------+-----+---------+-------+
            | id         | int         | YES  |     | NULL    |       |
            | email      | varchar(40) | YES  |     | NULL    |       |
            | first_name | varchar(20) | YES  |     | NULL    |       |
            +------------+-------------+------+-----+---------+-------+
-------------------------------------------------
-------------------------------------------------
    #use 18june;

    3) TRUNCATE : TRUNCATE command which mainly use to remove all rows from the table. 

        in a simple language we can say that TRUNCATE command remove all data from the table. 

        difference between drop and TRUNCATE

        drop : completly remove table from the database. 

            after executation of drop command we can't find out table in memory. 

        TRUNCATE : using of TRUNCATE we can just deleting all records from the table 
            not destroying table from the database. 


        drop : remove data , remove structure , remove table 
        TRUNCATE : remove data , remain structure as it is and remain table as it is 

        syntax : TRUNCATE table <tablename> 

    
    e.g.    
        id      name            subject 
        1       Anjali          Python
        2       Mittal          Java 
        4       
        
        by default increment by 1 when we execute TRUNCATE command 
        it reset counter from 1 

=========================================================
2) DML COMMAND :  DML Command stands for Data modification language 

    using of dml commands we can add, remove and update records in table. 

        i) INSERT 
        ii) UPDATE 
        iii) DELETE 

    i) INSERT : whenever we want to store new record in existing 
            table we have to execute insert command. 

            using of inser we can insert one or many records at a time. 

            there are various way to execute insert command. 

            1) traditional way : 

                INSERT INTO <TABLENAME>     
                    (column1,column2.....)
                    values (.....);

    -----------------------------------------------------------
    mysql> use 18june;
    mysql> show tables;
+------------------+
| Tables_in_18june |
+------------------+
| student          |
+------------------+


mysql> desc student;
+------------+-------------+------+-----+---------+-------+
| Field      | Type        | Null | Key | Default | Extra |
+------------+-------------+------+-----+---------+-------+
| id         | int         | YES  |     | NULL    |       |
| email      | varchar(40) | YES  |     | NULL    |       |
| first_name | varchar(20) | YES  |     | NULL    |       |
+------------+-------------+------+-----+---------+-------+
3 rows in set (0.01 sec)

mysql> insert into student
    -> (id,email,first_name)
    -> values
    -> (1,'a@gmail.com','aaaa');
Query OK, 1 row affected (0.10 sec)


mysql> select * from student;
+------+-------------+------------+
| id   | email       | first_name |
+------+-------------+------------+
|    1 | a@gmail.com | aaaa       |
+------+-------------+------------+

mysql> insert into student
    -> (id,email,first_name)
    -> values
    -> (5,'b@gmail.com','bbbb');
Query OK, 1 row affected (0.01 sec)

mysql> select * from student;
+------+-------------+------------+
| id   | email       | first_name |
+------+-------------+------------+
|    1 | a@gmail.com | aaaa       |
|    5 | b@gmail.com | bbbb       |
+------+-------------+------------+

------------------------------
multiple entries : 

syntax : insert into <tablename> 
          (column1,column2...)
          values
          (v1,...),
          (v2,...),
          (v3,...)

mysql> insert into student
    -> (id,email,first_name)
    -> values
    -> (2,'c@gmail.com','cccc'),
    -> (3,'d@gmail.com','dddd'),
    -> (4,'e@gmail.com','eeee');
    
mysql> select * from student;
+------+-------------+------------+
| id   | email       | first_name |
+------+-------------+------------+
|    1 | a@gmail.com | aaaa       |
|    5 | b@gmail.com | bbbb       |
|    2 | c@gmail.com | cccc       |
|    3 | d@gmail.com | dddd       |
|    4 | e@gmail.com | eeee       |
+------+-------------+------------+


-----------------------------------------------
ii) UPDATE : to update or modify existing field in table 
        using of update command. 

        syntax : 

        UPDATE <tablename>
        SET 
        columnname = value,
        columnname = value
        where id = <dynamicvalue>;


mysql> update student
    -> set
    -> first_name = "Anjali",
    -> email = 'anjali@gmail.com'
    -> where
    -> id = 1;


mysql> select * from student;
+------+------------------+------------+
| id   | email            | first_name |
+------+------------------+------------+
|    1 | anjali@gmail.com | Anjali     |
|    5 | b@gmail.com      | bbbb       |
|    2 | c@gmail.com      | cccc       |
|    3 | d@gmail.com      | dddd       |
|    4 | e@gmail.com      | eeee       |
+------+------------------+------------+
---------------------------------------------
1) primary key : which is represent current table indentity 
        which we can connect with another table 

    
mysql> create table emp
     (
     id int  primary key auto_increment,
     name varchar(20),
     salary int,
     city varchar(20)
     );


 desc emp;
+--------+-------------+------+-----+---------+----------------+
| Field  | Type        | Null | Key | Default | Extra          |
+--------+-------------+------+-----+---------+----------------+
| id     | int         | NO   | PRI | NULL    | auto_increment |
| name   | varchar(20) | YES  |     | NULL    |                |
| salary | int         | YES  |     | NULL    |                |
| city   | varchar(20) | YES  |     | NULL    |                |
+--------+-------------+------+-----+---------+----------------+

insert into emp
    -> (name,salary,city)
    -> values
    -> ('Anjali',15000,'Ahmedabad'),
    -> ('Riya',25000,'Ahmedabad'),
    -> ('Diya',20000,'Surat');

select * from emp;
+----+--------+--------+-----------+
| id | name   | salary | city      |
+----+--------+--------+-----------+
|  1 | Anjali |  15000 | Ahmedabad |
|  2 | Riya   |  25000 | Ahmedabad |
|  3 | Diya   |  20000 | Surat     |
+----+--------+--------+-----------+

 update emp
    -> set
    -> city = "Mumbai"
    -> where id = 1;

    select * from emp;
+----+--------+--------+-----------+
| id | name   | salary | city      |
+----+--------+--------+-----------+
|  1 | Anjali |  15000 | Mumbai    |
|  2 | Riya   |  25000 | Ahmedabad |
|  3 | Diya   |  20000 | Surat     |
+----+--------+--------+-----------++

-------------------------------------------------
-------------------------------------------------
==> constraints : A rule which is define which kind and what kind of 
    data we can store in table. 

    1) primary key : one table can have only 1 primary key 
                rule of primary key it must be unique 
                and not null. 

                1
                1   X 

                1 
                    X 
                3

    2) unique : which prevent duplications 
                syntax : 

                fieldname  data type   unique
            
    mysql> alter table emp
    -> add email varchar(20) unique;
    
    select * from emp;
+----+--------+--------+-----------+-------+
| id | name   | salary | city      | email |
+----+--------+--------+-----------+-------+
|  1 | Anjali |  15000 | Mumbai    | NULL  |
|  2 | Riya   |  25000 | Ahmedabad | NULL  |
|  3 | Diya   |  20000 | Surat     | NULL  |
+----+--------+--------+-----------+-------+

 update emp
    -> set
    -> email = 'a@gmail.com'
    -> where id = 1;

     select * from emp;
+----+--------+--------+-----------+-------------+
| id | name   | salary | city      | email       |
+----+--------+--------+-----------+-------------+
|  1 | Anjali |  15000 | Mumbai    | a@gmail.com |
|  2 | Riya   |  25000 | Ahmedabad | NULL        |
|  3 | Diya   |  20000 | Surat     | NULL        |
+----+--------+--------+-----------+-------------+

 update emp
    -> set email='a@gmail.com'
    -> where id = 2;
ERROR 1062 (23000): Duplicate entry 'a@gmail.com' for key 'emp.email'

    3) NOT NULL : when we want specific field at insert time we can assign not null

            syntax : fieldname  datatype   not null;

            create table emp 
            (
                id int primary key auto_increment,
                email varchar(20) unique not null
            );

            alter table emp modify name varchar(20) not null;

            mysql> insert into emp
    -> (salary,city,email)
    -> values
    -> (15000,'Ahm','b@gmail.com');
ERROR 1364 (HY000): Field 'name' doesn't have a default value

    4) default : it will add automatic value whenever we insert record 
            with null. 

            status = "PENDING" 

        alter table emp add status varchar(20) default "pending";

        desc emp;
+--------+-------------+------+-----+---------+----------------+
| Field  | Type        | Null | Key | Default | Extra          |
+--------+-------------+------+-----+---------+----------------+
| id     | int         | NO   | PRI | NULL    | auto_increment |
| name   | varchar(20) | NO   |     | NULL    |                |
| salary | int         | YES  |     | NULL    |                |
| city   | varchar(20) | YES  |     | NULL    |                |
| email  | varchar(20) | YES  | UNI | NULL    |                |
| status | varchar(20) | YES  |     | pending |                |
+--------+-------------+------+-----+---------+----------------+
        select * from emp;
+----+--------+--------+-----------+-------------+---------+
| id | name   | salary | city      | email       | status  |
+----+--------+--------+-----------+-------------+---------+
|  1 | Anjali |  15000 | Mumbai    | a@gmail.com | pending |
|  2 | Riya   |  25000 | Ahmedabad | NULL        | pending |
|  3 | Diya   |  20000 | Surat     | NULL        | pending |
+----+--------+--------+-----------+-------------+---------+

    5) check : this constraint which is used to validate value 
            condition wise 

        create table emp 
        (
            id int primary key auto_increment,
            email varchar(20) unique,
            age int check (age>=18)
        );

         alter table emp add age int;

         alter table emp
        -> add
        -> constraint age
        -> check (age>=18);

        desc emp;
+--------+-------------+------+-----+---------+----------------+
| Field  | Type        | Null | Key | Default | Extra          |
+--------+-------------+------+-----+---------+----------------+
| id     | int         | NO   | PRI | NULL    | auto_increment |
| name   | varchar(20) | NO   |     | NULL    |                |
| salary | int         | YES  |     | NULL    |                |
| city   | varchar(20) | YES  |     | NULL    |                |
| email  | varchar(20) | YES  | UNI | NULL    |                |
| status | varchar(20) | YES  |     | pending |                |
| age    | int         | YES  |     | NULL    |                |
+--------+-------------+------+-----+---------+----------------+
         insert into emp
         (name,salary,city,email,age)
         values
         ('shreya',45000,'mum','shre@gmail.com',45);

         insert into emp
        (name,salary,city,email,age)
        values
        ('shreya',45000,'mum','sh@gmail.com',5);
            ERROR 3819 (HY000): Check constraint 'age' is violated.

=========================================
6) foreign key : which is mainly use to connect with another table 

        when we want to provide relationship between two tables we have to use 
        foreign key 

        create department
        (
            id int primary key auto_increment,
            d_name varchar(20)    
        );

        1     IT 
        2     Admin 


        create table emp
        (
            id int primary key auto_increment,
            name varchar(20),
            d_id  int,
            foreign key (d_id) references department(id)
        );

===================================================
    iii) DELETE : when we want to remove specific row or records from the 
                existing table we have to use delete command 

            syntax : 

                delete from <tablename> where columnname = value; 


 delete from emp where id = 4;
Query OK, 1 row affected (0.01 sec)

mysql> select * from emp;
+----+--------+--------+-----------+-------------+---------+------+
| id | name   | salary | city      | email       | status  | age  |
+----+--------+--------+-----------+-------------+---------+------+
|  1 | Anjali |  15000 | Mumbai    | a@gmail.com | pending | NULL |
|  2 | Riya   |  25000 | Ahmedabad | NULL        | pending | NULL |
|  3 | Diya   |  20000 | Surat     | NULL        | pending | NULL |
+----+--------+--------+-----------+-------------+---------+------+
            
========================================
1) DDL 
2) DML 
3) DQL : Data query language 

    most powerfull command in sql language

    using of DQL we can retrive data from the database 
    with specific condition wise 

        i) select 

    when we want to retrive all data from the table 

        syntax : 

        select * from <tablename>;

===============================================
    => when we want to display specific field 

        syntax : 

        select column1,column2,column3...  from <tablename>;

         select name,city from emp ;
+--------+-----------+
| name   | city      |
+--------+-----------+
| Anjali | Mumbai    |
| Riya   | Ahmedabad |
| Diya   | Surat     |
+--------+-----------+
     => alter table emp add department varchar(20);
     => update emp set department = "IT" where id = 1;
     => update emp set department = "HR" where id = 2;
     => update emp set department = "IT" where id = 3;

    => fetch distinct record from the table 

select distinct department from emp;
+------------+
| department |
+------------+
| IT         |
| HR         |
+------------+

    => operators 

    comparision operator : 

    =  : compairsion equality 
    >  : greater than 
    < 
    >= 
    <= 
    != 

 select * from emp where salary > 20000;
+----+------+--------+-----------+-------+---------+------+------------+
| id | name | salary | city      | email | status  | age  | department |
+----+------+--------+-----------+-------+---------+------+------------+
|  2 | Riya |  25000 | Ahmedabad | NULL  | pending | NULL | HR         |
+----+------+--------+-----------+-------+---------+------+------------+
1 row in set (0.00 sec)

mysql> select * from emp where salary >= 20000;
+----+------+--------+-----------+-------+---------+------+------------+
| id | name | salary | city      | email | status  | age  | department |
+----+------+--------+-----------+-------+---------+------+------------+
|  2 | Riya |  25000 | Ahmedabad | NULL  | pending | NULL | HR         |
|  3 | Diya |  20000 | Surat     | NULL  | pending | NULL | IT         |
+----+------+--------+-----------+-------+---------+------+------------+

select * from emp where department != "IT";
+----+------+--------+-----------+-------+---------+------+------------+
| id | name | salary | city      | email | status  | age  | department |
+----+------+--------+-----------+-------+---------+------+------------+
|  2 | Riya |  25000 | Ahmedabad | NULL  | pending | NULL | HR         |
+----+------+--------+-----------+-------+---------+------+------------+
--------------------------------------

update emp set age = 25 where id = 1;
update emp set age = 35 where id = 2;
update emp set age = 29 where id = 3;

 select * from emp;
+----+--------+--------+-----------+-------------+---------+------+------------+
| id | name   | salary | city      | email       | status  | age  | department |
+----+--------+--------+-----------+-------------+---------+------+------------+
|  1 | Anjali |  15000 | Mumbai    | a@gmail.com | pending |   25 | IT         |
|  2 | Riya   |  25000 | Ahmedabad | NULL        | pending |   35 | HR         |
|  3 | Diya   |  20000 | Surat     | NULL        | pending |   29 | IT         |
+----+--------+--------+-----------+-------------+---------+------+------------+


logical operator : 

        AND  : check both the condition and make sure both are true 
        OR   : need one or more condition true 
        NOT  : except this 


        select * from emp where city="Ahmedabad" and age >= 20;
+----+------+--------+-----------+-------+---------+------+------------+
| id | name | salary | city      | email | status  | age  | department |
+----+------+--------+-----------+-------+---------+------+------------+
|  2 | Riya |  25000 | Ahmedabad | NULL  | pending |   35 | HR         |
+----+------+--------+-----------+-------+---------+------+------------+

        e.g.   student 

            email password username 

            select * from student where email=    and password = ;

OR : Operator 

select * from emp where department ="IT" or department="Admin";
+----+--------+--------+--------+-------------+---------+------+------------+
| id | name   | salary | city   | email       | status  | age  | department |
+----+--------+--------+--------+-------------+---------+------+------------+
|  1 | Anjali |  15000 | Mumbai | a@gmail.com | pending |   25 | IT         |
|  3 | Diya   |  20000 | Surat  | NULL        | pending |   29 | IT         |
+----+--------+--------+--------+-------------+---------+------+------------+


NOT ::::: 

select * from emp where not department = "HR";
+----+--------+--------+--------+-------------+---------+------+------------+
| id | name   | salary | city   | email       | status  | age  | department |
+----+--------+--------+--------+-------------+---------+------+------------+
|  1 | Anjali |  15000 | Mumbai | a@gmail.com | pending |   25 | IT         |
|  3 | Diya   |  20000 | Surat  | NULL        | pending |   29 | IT         |
|  5 | kiya   |  19000 | mumbai | k@gmail.com | pending |   35 | Sales      |
|  6 | Niya   |  45000 | mumbai | n@gmail.com | pending |   29 | Sales      |
+----+--------+--------+--------+-------------+---------+------+------------+

IN : operator 

select * from emp where city in ("Ahmedabad","mumbai");
+----+--------+--------+-----------+-------------+---------+------+------------+
| id | name   | salary | city      | email       | status  | age  | department |
+----+--------+--------+-----------+-------------+---------+------+------------+
|  1 | Anjali |  15000 | Mumbai    | a@gmail.com | pending |   25 | IT         |
|  2 | Riya   |  25000 | Ahmedabad | NULL        | pending |   35 | HR         |
|  5 | kiya   |  19000 | mumbai    | k@gmail.com | pending |   35 | Sales      |
|  6 | Niya   |  45000 | mumbai    | n@gmail.com | pending |   29 | Sales      |
+----+--------+--------+-----------+-------------+---------+------+------------+
4 rows in set (0.00 sec)

NOT IN : operator 

 select * from emp where department not in ("IT","HR");
+----+------+--------+--------+-------------+---------+------+------------+
| id | name | salary | city   | email       | status  | age  | department |
+----+------+--------+--------+-------------+---------+------+------------+
|  5 | kiya |  19000 | mumbai | k@gmail.com | pending |   35 | Sales      |
|  6 | Niya |  45000 | mumbai | n@gmail.com | pending |   29 | Sales      |
+----+------+--------+--------+-------------+---------+------+------------+
2 rows in set (0.00 sec)

BETWEEN 

mysql> select * from emp where salary between 30000 and 50000;

---------------------------------------------------------
ORDER BY 

when we want to retrive records by ASC order or desc 

    by default order by asc by ID field 

select * from emp order by salary;
+----+--------+--------+-----------+-------------+---------+------+------------+
| id | name   | salary | city      | email       | status  | age  | department |
+----+--------+--------+-----------+-------------+---------+------+------------+
|  1 | Anjali |  15000 | Mumbai    | a@gmail.com | pending |   25 | IT         |
|  5 | kiya   |  19000 | mumbai    | k@gmail.com | pending |   35 | Sales      |
|  3 | Diya   |  20000 | Surat     | NULL        | pending |   29 | IT         |
|  2 | Riya   |  25000 | Ahmedabad | NULL        | pending |   35 | HR         |
|  6 | Niya   |  45000 | mumbai    | n@gmail.com | pending |   29 | Sales      |
+----+--------+--------+-----------+-------------+---------+------+------------+

 select name as username , salary as income from emp;
+----------+--------+
| username | income |
+----------+--------+
| Anjali   |  15000 |
| Riya     |  25000 |
| Diya     |  20000 |
| kiya     |  19000 |
| Niya     |  45000 |
+----------+--------+

select name,salary,department from emp order by salary desc;
+--------+--------+------------+
| name   | salary | department |
+--------+--------+------------+
| Niya   |  45000 | Sales      |
| Riya   |  25000 | HR         |
| Diya   |  20000 | IT         |
| kiya   |  19000 | Sales      |
| Anjali |  15000 | IT         |
+--------+--------+------------+
5 rows in set (0.00 sec)


select name,department,salary from emp
    -> where department="IT"
    -> order by
    -> salary
    -> desc;
+--------+------------+--------+
| name   | department | salary |
+--------+------------+--------+
| Diya   | IT         |  20000 |
| Anjali | IT         |  15000 |
+--------+------------+--------+

----------------------------------------------
limit : we can set limit how many records we want using

    select query 

    select * from emp limit 3;
+----+--------+--------+-----------+-------------+---------+------+------------+
| id | name   | salary | city      | email       | status  | age  | department |
+----+--------+--------+-----------+-------------+---------+------+------------+
|  1 | Anjali |  15000 | Mumbai    | a@gmail.com | pending |   25 | IT         |
|  2 | Riya   |  25000 | Ahmedabad | NULL        | pending |   35 | HR         |
|  3 | Diya   |  20000 | Surat     | NULL        | pending |   29 | IT         |
+----+--------+--------+-----------+-------------+---------+------+------------+
3 rows in set (0.00 sec)

select name,department,city,salary from emp
    -> where salary > 15000
    -> order by salary
    -> desc
    -> limit 2;
+------+------------+-----------+--------+
| name | department | city      | salary |
+------+------------+-----------+--------+
| Niya | Sales      | mumbai    |  45000 |
| Riya | HR         | Ahmedabad |  25000 |
+------+------------+-----------+--------+


LIKE :

 select * from emp where name like 'a%';
+----+--------+--------+--------+-------------+---------+------+------------+
| id | name   | salary | city   | email       | status  | age  | department |
+----+--------+--------+--------+-------------+---------+------+------------+
|  1 | Anjali |  15000 | Mumbai | a@gmail.com | pending |   25 | IT         |
+----+--------+--------+--------+-------------+---------+------+------------+

select * from emp where name like '%n%';
+----+--------+--------+--------+-------------+---------+------+------------+
| id | name   | salary | city   | email       | status  | age  | department |
+----+--------+--------+--------+-------------+---------+------+------------+
|  1 | Anjali |  15000 | Mumbai | a@gmail.com | pending |   25 | IT         |
|  6 | Niya   |  45000 | mumbai | n@gmail.com | pending |   29 | Sales      |
+----+--------+--------+--------+-------------+---------+------+------------+


--------------------------------------------------------
page 0   ---  0 - 10 

page 1   ---  11 -20   OFFSET 

 select name from emp
    -> limit 2 offset 0;
+--------+
| name   |
+--------+
| Anjali |
| Riya   |
+--------+

